{
  "$schema": "https://overkill-factory.dev/schemas/hermes-update-receipt.schema.json",
  "record_type": "hermes_update_receipt",
  "created_at": "2026-06-09T18:45:03+00:00",
  "scope": "vFinal local adapter and clean proof only",
  "before": {
    "hermes_version": "not_checked_in_this_local_smoke",
    "commit": "not_checked_in_this_local_smoke"
  },
  "after": {
    "hermes_version": "not_updated",
    "commit": "not_updated"
  },
  "adapter_patch": {
    "path": "adapters/hermes/patches/0001-add-overkill-factory-10-kanban-gates.patch",
    "sha256": "not_recomputed_in_this_local_smoke",
    "apply_result": "not_applied_to_real_hermes_runtime"
  },
  "checks": {
    "compatibility_check": "PASS",
    "unit_tests": "PASS",
    "public_json_validation": "PASS",
    "public_safety_scan": "PASS",
    "secret_safety_scan": "PASS",
    "vfinal_transition_smoke": "PASS",
    "local_clean_proof": "PASS",
    "disposable_adapter_runtime_smoke": "PASS",
    "disposable_installed_hermes_runtime_smoke": "PENDING_REAL_HERMES_RUNTIME",
    "dashboard_api_smoke": "PENDING_REAL_HERMES_RUNTIME"
  },
  "decision": {
    "real_runtime_update": "blocked_until_disposable_installed_hermes_smoke",
    "risk_owner": "product-owner",
    "rollback_plan": "No real Hermes runtime was updated in this local smoke."
  },
  "evidence_refs": [
    "validation/hermes-smoke/vfinal-transition-smoke.json",
    "validation/remote-proof/vfinal-local-clean-smoke.json",
    "validation/hermes-disposable-runtime/disposable-runtime-smoke.json",
    "adapters/hermes/vfinal-smoke.py",
    "adapters/hermes/disposable_runtime_smoke.py",
    "tests/test_hermes_transition_hook.py"
  ]
}
